[
  {
    "source_id": "source_texarkana_1885_sanborn_loc",
    "title": "Sanborn Fire Insurance Map from Texarkana, Bowie County, Texas",
    "source_type": "sanborn_map",
    "repository": "Library of Congress Geography and Map Division",
    "url": "https://www.loc.gov/item/sanborn08781_001/",
    "citation": "Sanborn Fire Insurance Map from Texarkana, Bowie County, Texas. Sanborn Map Company, Oct. 1885. Map. Library of Congress, Geography and Map Division. https://www.loc.gov/item/sanborn08781_001/.",
    "rights_status": "public_domain",
    "access_level": "digital_image",
    "accessed_date": "2026-07-06",
    "notes": "LOC item sanborn08781_001. Digitized Sanborn Maps Collection record with 5 sheets. LOC rights statement says the online Sanborn Maps Collection is in the public domain and free to use and reuse. Credit line: Library of Congress, Geography and Map Division, Sanborn Maps Collection."
  },
  {
    "source_id": "source_texarkana_1885_newspaper_placeholder",
    "title": "1885 Texarkana newspaper item placeholder",
    "source_type": "newspaper",
    "repository": "Portal to Texas History or other archive to be verified",
    "url": "",
    "citation": "Placeholder citation. Replace with a verified newspaper item before classroom use.",
    "rights_status": "unknown",
    "access_level": "metadata",
    "accessed_date": "2026-07-05",
    "notes": "Placeholder for source-manifest validation only."
  },
  {
    "source_id": "source_texarkana_1893_daily_texarkana_democrat_098_p3",
    "title": "Daily Texarkana Democrat issue page 3",
    "source_type": "newspaper_issue_page",
    "repository": "The Portal to Texas History",
    "url": "https://texashistory.unt.edu/ark:/67531/metapth1644239/m1/3/",
    "citation": "Daily Texarkana Democrat, Vol. 10, No. 98, Ed. 1, December 20, 1893, page 3 of 4, Portal to Texas History.",
    "rights_status": "public_domain",
    "access_level": "digital_image",
    "accessed_date": "2026-07-07",
    "notes": "Issue page used as a source-issue adapter seed for person and business review lanes. The OCR includes A. S. Blythe and H. T. Huey business text."
  }
]
